<?xml version="1.0" encoding="UTF-8"?>
<retornarTodasComarcasResponse 
	xmlns="comarca.soap.integracaoSiscondj.tjrj.jus.br"
	xsi:schemaLocation="comarca.soap.integracaoSiscondj.tjrj.jus.br comarca-schema.xsd"
	xmlns:xsi="http://www.w3.org/2001/XMLSchema-instance">	
	<codigoRetorno>0</codigoRetorno>
	 <listaComarcas>
		 <codigo>5</codigo>
		 <instancia>1</instancia>
		 <nome>ALTO ALEGRE</nome>
	 </listaComarcas>
	 <listaComarcas>
		 <codigo>10</codigo>
		 <instancia>1</instancia>
		 <nome>BOA VISTA</nome>
	 </listaComarcas>
	 <listaComarcas>
		 <codigo>90</codigo>
		 <instancia>1</instancia>
		 <nome>BONFIM</nome>
	 </listaComarcas>
 </retornarTodasComarcasResponse>
 